name,url,category,brand,specifications,prices,image_links,features,needs
PC CPS Core Work X147F406T i7-14700F / RTX 4060 Ti / WIN11 PRO,https://cellphones.com.vn/pc-cps-core-work-x147f406t.html,pc,Hãng khác,"{'Dung lượng RAM': '16GB', 'RAM': 'PC Kingston Fury Beast DDR5 5600MHz 16GB (1x16GB) KF556C40BB-16', 'SSD': 'SSD Adata Legend 860 PCIe Gen4 X4 M.2 2280 (R 6000/W 5000) 500GB', 'CPU': 'Intel Core i7-14700F (SN)', 'VGA': 'ASUS Dual GeForce RTX 4060 Ti OC 16GB DUAL-RTX4060TI-O16G-EVO', 'Mainboard': 'ASUS TUF Gaming B760M-Plus WiFi D5 (SN)', 'Nguồn': 'MSI MAG A750BN PCIe5 750W (80 PLUS Bronze)', 'Chipset (PC lắp ráp)': 'B760M', 'Hệ điều hành': 'Windows 11 Pro', 'Loại case (PC)': 'Case Máy Tính Xigmatek XS-09 M-ATX', 'Loại PC': 'PC Intel'}","[{'color': 'default', 'price': 31490000}]","['https://cdn2.cellphones.com.vn/x/media/catalog/product/t/e/text_ng_n_12__7_4_12.png', 'https://cdn2.cellphones.com.vn/x/media/catalog/product/t/e/text_ng_n_15__7_154_12.png', 'https://cdn2.cellphones.com.vn/x/media/catalog/product/t/e/text_ng_n_13__7_8_12.png', 'https://cdn2.cellphones.com.vn/x/media/catalog/product/t/e/text_ng_n_14__8_9_11.png']","['Trang bị CPU Intel Core i7-14700F, mang lại hiệu suất cao cho các tác vụ đa nhiệm và đồ họa phức tạp.', 'Mainboard ASUS TUF Gaming B760M-Plus WIFI D5 hỗ trợ kết nối không dây, cung cấp tính năng ổn định và bền bỉ cho hệ thống.', 'Card đồ họa RTX 4060 Ti OC 16GB cho khả năng xử lý đồ họa ấn tượng, rất phù hợp cho công việc sáng tạo và giải trí.', 'RAM 16GB Kingston Fury Beast DDR5 5600MHz giúp xử lý đa nhiệm hiệu quả, đáp ứng nhu cầu sử dụng chuyên nghiệp.', 'Ổ cứng SSD 500GB với tốc độ đọc 6000MB/s và ghi 5000MB/s, giúp khởi động nhanh chóng và tải ứng dụng mượt mà.']",
PC Mini Asus NUC 13TH Arena Canyon,https://cellphones.com.vn/may-tinh-pc-mini-asus-nuc-13th-arena-canyon.html,pc,ASUS,"{'Loại card đồ họa': 'Intel UHD', 'Loại CPU': 'Intel Core i3-1315U (Up to 4.5 GHz) 6 lõi 8 luồng 10MB', 'Loại RAM': 'DDR4', 'Số khe ram': '2 x DDR4 SO-DIMM up to 3200 MHz', 'Ổ cứng': ['1 x SSD M.2 2280 PCIe Gen4 x4 slot ', ' 1 x SSD M.2 2242 PCIe Gen3 slot ', ' 1 x 2.5 inch'], 'Cổng I/O mặt sau': ['2 x HDMI 2.1 ', '\r', '2 x cổng ThunderBolt 4 (Alt-DP) ', '\r', '1 x USB 3.2 Gen2 Type-A ', '\r', '1 x USB 2.0 Type-A ', '\r', '1 x LAN 2.5Gb port ', '\r', 'Analog audio'], 'Cổng I/O mặt trước': ['2 x USB 3.2 Gen2 Type-A ', '\r', '1 x 3.5mm Audio Jack'], 'Khe đọc thẻ nhớ': 'Không', 'Wi-Fi': 'Wi-Fi 6E AX211', 'Bluetooth': 'Bluetooth 5.2', 'Tính năng đặc biệt': 'Wi-Fi 6', 'Nguồn': '20Vdc, 90W', 'Hệ điều hành': 'No OS', 'Kích thước': '117 x 112 x 54 mm'}","[{'color': 'Đen', 'price': 9190000}]","['https://cdn2.cellphones.com.vn/x/media/catalog/product/p/c/pc-mini_2.png', 'https://cdn2.cellphones.com.vn/x/media/catalog/product/s/l/slide_pc_mi.png', 'https://cdn2.cellphones.com.vn/x/media/catalog/product/p/c/pc-mini_1_.png', 'https://cdn2.cellphones.com.vn/x/media/catalog/product/p/c/pc-mini_3_.png', 'https://cdn2.cellphones.com.vn/x/media/catalog/product/p/c/pc-mini_2_.png']","['Trang bị chip Intel Core i3-1315U thế hệ 13 mới nhất xử lý mượt mà các tác vụ văn phòng, giải trí cơ bản trong một thiết kế cực kỳ nhỏ gọn.', 'Hỗ trợ WiFi 6 và Bluetooth cho kết nối nhanh chóng, ổn định, cùng nhiều cổng kết nối đa dạng, dễ dàng kết nối với các thiết bị ngoại vi.', 'Kích thước siêu nhỏ gọn giúp tiết kiệm không gian bàn làm việc, mang đến không gian gọn gàng, hiện đại.', 'Dễ dàng nâng cấp RAM và ổ cứng để đáp ứng nhu cầu sử dụng trong tương lai.', 'Phù hợp cho các tác vụ văn phòng, lướt web, xem phim, nghe nhạc và chơi game nhẹ nhàng.']",['Máy tính đồng bộ']
PC CPS Gaming G03 R5 5500 / 16GB - 256GB / RX 6500,https://cellphones.com.vn/pc-cps-gaming-g3-amd.html,pc,Hãng khác,"{'CPU': 'AMD Ryzen 5 5500', 'VGA': 'VGA Asus Dual Radeon RX 6500 XT OC 4GB DUAL-RX6500XT-O4G-V2', 'Socket': 'AMD AM4', 'RAM': 'RAM PC ADATA XPG D50 RGB 8GB (1x8GB) 3200MHz DDR4', 'SSD': 'SSD ADATA SU650 SATA III 2.5"" 256GB', 'Mainboard': 'B550M', 'Nguồn': '400W', 'Chipset (PC lắp ráp)': 'B550M', 'Loại case (PC)': 'Case máy tính Xigmatek Sky II 3F ATX', 'Loại PC': 'PC AMD'}","[{'color': 'default', 'price': 11390000}]","['https://cdn2.cellphones.com.vn/x/media/catalog/product/p/c/pc-cps-gaming-g10-infographic-3_2_.jpg', 'https://cdn2.cellphones.com.vn/x/media/catalog/product/p/c/pc-cps-gaming-g3_3_.png', 'https://cdn2.cellphones.com.vn/x/media/catalog/product/p/c/pc-cps-gaming-g3_2_.png', 'https://cdn2.cellphones.com.vn/x/media/catalog/product/p/c/pc-cps-gaming-g3_4_.png']","['PC G03 được chế tác từ linh kiện chất lượng cao.', 'Cấu hình đủ đáp ứng cho những tựa game mạnh.', 'Hỗ trợ card màn hình RX 5500 cho việc chơi game.', 'Thiết kế case gọn nhẹ phù hợp đặt mọi không gian.']",['PC ráp sẵn CellphoneS']
PC Mini Asus ROG NUC 14th Scorpion Canyon U9,https://cellphones.com.vn/may-tinh-pc-mini-asus-rog-nuc-14th-scorpion-canyon-u9.html,pc,ASUS,"{'Loại card đồ họa': 'RTX 4070', 'Loại CPU': 'Intel Core Ultra 9 185H', 'Loại RAM': 'DDR5 5600MHz', 'Số khe ram': '(8GB x2) DDR5 5600MHz SODIMM (maximum 64GB)', 'Ổ cứng': ['1x 512GB M.2 2280 PCIe Gen4x4 SSD', '  3 khe cắm M.2 2280 PCIe Gen4x4 (có sẵn)'], 'Cổng I/O mặt sau': ['1 x Thunderbolt™4/ USB4 Type C port (Supports DP2.1 and 5V/9V/12V fast charging profiles)', '\r', '2 x USB 3.2 Gen2 Type-A', '\r', '2 x USB 2.0 Type-A', '\r', '1 x HDMI port', '\r', '2 x DP1.4a port', '\r', '1 x 2.5G RJ45 LAN', '\r', '1 x DC-in', '\r', '1 x Kensington Lock slot'], 'Cổng I/O cạnh sườn máy': ['1 x SD Express ver8.0 Card Reader (UHS-I support)', '\r', '2 x USB 3.2 Gen2 Type-A', '\r', '1 x Audio Jack (Line out/Mic in/Headphone out/Headset)'], 'Tính năng đặc biệt': 'Wi-Fi 6', 'Nguồn': '330W', 'Hãng sản xuất': 'ASUS', 'Hệ điều hành': 'No OS', 'Kích thước': '270 x 180 x 50 mm (W x D x H)', 'Trọng lượng': '2.6 kg', 'Wi-Fi': 'Intel Killer Wi-Fi 6E (Gig+) 2x2', 'Bluetooth': 'Bluetooth 5.3'}","[{'color': 'Đen', 'price': 49990000}]","['https://cdn2.cellphones.com.vn/x/media/catalog/product/g/r/group_531_1_.png', 'https://cdn2.cellphones.com.vn/x/media/catalog/product/t/e/text_ng_n_31__3_14.png', 'https://cdn2.cellphones.com.vn/x/media/catalog/product/t/e/text_ng_n_32__2_14.png', 'https://cdn2.cellphones.com.vn/x/media/catalog/product/t/e/text_ng_n_33__3_13.png', 'https://cdn2.cellphones.com.vn/x/media/catalog/product/t/e/text_ng_n_34__3_15.png', 'https://cdn2.cellphones.com.vn/x/media/catalog/product/t/e/text_ng_n_35__3_14.png']","['Trang bị CPU Intel Core Ultra 9 185H, mang đến trải nghiệm game vượt trội, trong một thiết kế cực kỳ nhỏ gọn.', 'Không cài đặt sẵn hệ điều hành, cho phép người dùng tự do lựa chọn và cài đặt hệ điều hành theo nhu cầu sử dụng.', 'Trang bị card đồ họa RTX 4070, mang đến trải nghiệm hình ảnh tuyệt đẹp và sắc nét.', 'Thiết kế nhỏ gọn giúp tiết kiệm không gian.']","['Máy tính đồng bộ', 'PC ráp sẵn CellphoneS']"
PC ASUS V500MV-13420H136W,https://cellphones.com.vn/pc-asus-v500mv-13420h136w.html,pc,ASUS,"{'Loại card đồ họa': 'Intel Iris Xe Graphics', 'Loại CPU': 'Intel Core i5-13420H 2.1 GHz (12MB Cache, up to 4.6 GHz, 8 lõi, 12 luồng)', 'Dung lượng RAM': '16GB', 'Loại RAM': 'DDR5 SO-DIMM tốc độ bộ nhớ là 5600MHz, nhưng chạy ở mức 4800~5200MHz', 'Số khe ram': '2x 8GB (Tối đa 64GB)', 'Ổ cứng': '512GB M.2 2280 NVMe PCIe 4.0 SSD', 'Công nghệ âm thanh': 'High Definition 7.1 Channel Audio', 'Loại đèn bàn phím': ['Bàn phím có dây (USB) ', ' Chuột quang có dây (USB)'], 'Bảo mật': ['Bảo vệ và bảo mật mật khẩu người dùng ổ cứng', ' Khe cắm Kensington Security (7x 3mm)', ' Bản dùng thử miễn phí McAfee 30 ngày'], 'Hệ điều hành': 'Windows 11 Home', 'Cổng I/O mặt trước': ['1x 3.5mm combo audio jack', '\r', '1x USB 3.2 Gen 1 Type-C', '\r', '2x USB 3.2 Gen 1 Type-A'], 'Cổng I/O mặt sau': ['1x RJ45 Gigabit Ethernet', '\r', '1x HDMI 1.4', '\r', '1x Displayport 1.4', '\r', '1x âm thanh 7.1 kênh (3 cổng)', '\r', '1x khóa Kensington', '\r', '4x USB 2.0 Type-A'], 'Loại PC': 'PC Intel', 'Kích thước': '15.50 x 29.60 x 34.70 cm', 'Trọng lượng': '6.00 kg', 'Wi-Fi': 'Wi-Fi 6(802.11ax) (Dual band) 2*2', 'Bluetooth': 'Bluetooth 5.3', 'Cổng giao tiếp': ['Khe cắm mở rộng (bao gồm cả đã sử dụng): ', '1x PCIe 4.0 x 16', ' 1x M.2 connector for WiFi']}","[{'color': 'Đen', 'price': 15690000}]","['https://cdn2.cellphones.com.vn/x/media/catalog/product/t/e/text_ng_n_17__8_70_1_1_1.png', 'https://cdn2.cellphones.com.vn/x/media/catalog/product/t/e/text_ng_n_16__6_118_1_1_1.png', 'https://cdn2.cellphones.com.vn/x/media/catalog/product/t/e/text_ng_n_2__8_16_1_1_1.png', 'https://cdn2.cellphones.com.vn/x/media/catalog/product/t/e/text_ng_n_6__2_253_1_1_1.png', 'https://cdn2.cellphones.com.vn/x/media/catalog/product/t/e/text_ng_n_3__7_12_1_1_1.png']","['Trang bị vi xử lý Intel Core i5-13420H, mang lại khả năng xử lý mượt mà cho các tác vụ văn phòng và giải trí.', 'Với 16GB RAM và ổ SSD 512GB, máy đảm bảo tốc độ truy cập dữ liệu nhanh chóng, giúp tăng hiệu suất làm việc.', 'Hỗ trợ Wi-Fi và các cổng kết nối đa dạng, giúp người dùng dễ dàng kết nối với các thiết bị khác.', 'Chạy trên Windows 11, mang lại trải nghiệm người dùng thân thiện và nhiều tính năng mới hấp dẫn.']",
PC CPS Creator Ultra AI A149 i9-14900K / RTX 5070 Ti,https://cellphones.com.vn/pc-cps-creator-ultra-ai-a149.html,pc,Hãng khác,"{'Dung lượng RAM': '64GB', 'RAM': 'PC Kingston Fury Beast RGB DDR5 5600MHz 64GB (2x32GB)', 'SSD': 'SSD Kingston SKC3000 M.2 PCIe Gen 4 NVMe 1TB (SN)', 'CPU': 'Intel Core i9-14900K (SN)', 'VGA': 'ASUS Prime GeForce RTX 5070 Ti 16GB PRIME-RTX5070TI-16G', 'Mainboard': 'MSI Z790 Gaming Plus WF DDR5', 'Nguồn': 'Corsair RM850E Đen', 'Chipset (PC lắp ráp)': 'Z790', 'Tản nhiệt': ['Tản Nhiệt Nước Corsair iCUE Link Titan 360 RX RGB Đen ', 'Fan Case Corsair RS120 ARGB Black (3 Pack)'], 'Loại case (PC)': 'Case Máy Tính Corsair 3500X Đen', 'Loại PC': 'PC Intel'}","[{'color': 'default', 'price': 66990000}]","['https://cdn2.cellphones.com.vn/x/media/catalog/product/t/e/text_ng_n_8__6_114.png', 'https://cdn2.cellphones.com.vn/x/media/catalog/product/t/e/text_ng_n_9__9_108.png', 'https://cdn2.cellphones.com.vn/x/media/catalog/product/t/e/text_ng_n_10__5_131.png', 'https://cdn2.cellphones.com.vn/x/media/catalog/product/t/e/text_ng_n_12__8_62.png', 'https://cdn2.cellphones.com.vn/x/media/catalog/product/t/e/text_ng_n_11__7_75.png']","['Trang bị CPU Intel Core i9-14900K, mang lại hiệu suất hàng đầu cho các tác vụ nặng và sáng tạo nội dung chuyên sâu.', 'Mainboard MSI Z790 Gaming Plus với hỗ trợ WiFi, đảm bảo kết nối ổn định và tốc độ cao.', 'VGA RTX 5070 Ti 16GB cung cấp khả năng xử lý đồ họa xuất sắc, lý tưởng cho gaming và các ứng dụng đồ họa phức tạp.', 'RAM 64GB DDR5 với tốc độ 5600MHz nâng cao hiệu suất đa nhiệm và tạo điểm nhấn thẩm mỹ với đèn RGB.', 'Ổ cứng SSD 1TB mang lại tốc độ truy xuất dữ liệu rất nhanh chóng, giúp khởi động hệ thống và tải ứng dụng tức thì.']",
PC CPS Gaming G09 i3 12100F / 8GB - 256GB / RX 6600,https://cellphones.com.vn/pc-cps-gaming-g09.html,pc,Hãng khác,"{'Dung lượng RAM': '8GB', 'SSD': '256GB', 'CPU': 'Intel Core i3-12100F', 'VGA': 'AMD Radeon RX 6600', 'Socket': 'LGA 1700', 'Mainboard': 'H610M', 'Nguồn': '600W', 'Chipset (PC lắp ráp)': 'H610M', 'Loại case (PC)': 'M-ATX', 'Loại PC': 'PC Intel'}","[{'color': 'default', 'price': 11890000}]","['https://cdn2.cellphones.com.vn/x/media/catalog/product/t/e/text_ng_n_7__2_165_4.png', 'https://cdn2.cellphones.com.vn/x/media/catalog/product/t/e/text_ng_n_9__4_176_4.png', 'https://cdn2.cellphones.com.vn/x/media/catalog/product/t/e/text_ng_n_8__4_166_3.png']","['Bộ vi xử lý Intel Core i3-12100F mang lại hiệu suất tốt cho các tác vụ văn phòng và chơi game nhẹ, lý tưởng cho người dùng phổ thông.', 'Mainboard H610M-HVS/M.2 R2.0 hỗ trợ các tính năng hiện đại, giúp tối ưu hóa khả năng kết nối và mở rộng.', 'VGA AMD Radeon RX 6600 Challenger D 8GB cung cấp khả năng xử lý đồ họa mạnh mẽ, phù hợp cho game thủ yêu thích trải nghiệm hình ảnh sắc nét.', 'RAM 8GB DDR4 không chỉ nhanh mà còn thêm phần nổi bật với hiệu ứng ánh sáng RGB.', 'SSD 256GB đảm bảo tốc độ khởi động nhanh và hiệu suất truy cập dữ liệu vượt trội.']",['PC ráp sẵn CellphoneS']
PC CPS Core Work P144F650 i5-14400F / RX 6500,https://cellphones.com.vn/pc-cps-core-work-p144f650.html,pc,Hãng khác,"{'Dung lượng RAM': '16GB', 'RAM': '2 x PC Kingston Fury 8GB 3200MHz KF432C16BB/8', 'SSD': 'SSD Adata Legend 710 PCIe Gen3 X4 M.2 2280 (R 2400/W 1800) 256GB', 'CPU': 'Intel Core i5-14400F (SN)', 'VGA': 'ASUS Dual Radeon RX 6500 XT OC 4GB DUAL-RX6500XT-O4G-V2', 'Mainboard': 'ASUS Prime B760M-A DDR4', 'Nguồn': 'Xigmatek Litepower II Plus IP750 600W', 'Chipset (PC lắp ráp)': 'B760M', 'Loại case (PC)': 'Case Máy Tính Xigmatek XS-09 M-ATX', 'Loại PC': 'PC Intel'}","[{'color': 'default', 'price': 13990000}]","['https://cdn2.cellphones.com.vn/x/media/catalog/product/t/e/text_ng_n_12__7_4_8_1.png', 'https://cdn2.cellphones.com.vn/x/media/catalog/product/t/e/text_ng_n_15__7_154_8_1.png', 'https://cdn2.cellphones.com.vn/x/media/catalog/product/t/e/text_ng_n_14__8_9_7_1.png', 'https://cdn2.cellphones.com.vn/x/media/catalog/product/t/e/text_ng_n_13__7_8_8_1.png']","['Trang bị CPU Intel Core i5-14400F, mang lại hiệu suất mạnh mẽ cho các tác vụ văn phòng và xử lý đa nhiệm.', 'Mainboard ASUS PRIME B760M-A hỗ trợ DDR4, cung cấp tính năng ổn định và đáng tin cậy cho hệ thống.', 'Card đồ họa ASUS DUAL RADEON RX 6500 XT OC 4GB mang đến khả năng xử lý đồ họa mượt mà, phù hợp cho nhu cầu làm việc và giải trí.', 'RAM 16GB 3200MHz giúp xử lý đa nhiệm hiệu quả, đáp ứng nhu cầu sử dụng hàng ngày.', 'Ổ cứng SSD 256GB với tốc độ đọc 2400MB/s và ghi 1800MB/s, giúp khởi động nhanh chóng và tải ứng dụng hiệu quả.']",
PC CPS văn phòng S02 i3 12100 / 8GB - 256GB,https://cellphones.com.vn/pc-cps-van-phong-s2.html,pc,Hãng khác,"{'Loại card đồ họa': 'Onboard', 'CPU': 'i3 12100', 'VGA': 'Onboard', 'Socket': 'Intel LGA 1700', 'Loại CPU': 'Intel Core i3 12100', 'Dung lượng RAM': '8GB', 'Loại RAM': 'DDR4 3200Mhz', 'Số khe ram': '2 x DDR4', 'Ổ cứng': 'SSD 256GB Sata III', 'RAM': '8GB', 'SSD': '256GB', 'Mainboard': 'H610M', 'Nguồn': '250W', 'Chipset (PC lắp ráp)': 'H610M', 'Cổng I/O mặt sau': ['1 x bàn phím PS / 2 (màu tím)', '1 x chuột PS / 2 (màu xanh)', '1 x D-Sub', '1 x HDMI', '1 x cổng LAN (RJ45)', '4 x USB 3.1 thế hệ thứ 1 (màu xanh)', '2 x USB 2.0', '3 x giắc cắm âm thanh'], 'Loại PC': 'PC Intel', 'Kích thước': '297 x 188 x 413 mm'}","[{'color': 'default', 'price': 6390000}]","['https://cdn2.cellphones.com.vn/x/media/catalog/product/p/c/pc-cps-van-phong-s2_1.jpg', 'https://cdn2.cellphones.com.vn/x/media/catalog/product/p/c/pc-cps-van-phong-s2_2__1.jpg', 'https://cdn2.cellphones.com.vn/x/media/catalog/product/p/c/pc-cps-van-phong-s2_3__1.jpg', 'https://cdn2.cellphones.com.vn/x/media/catalog/product/p/c/pc-cps-van-phong-s2_1__1.jpg']","['Bộ vi xử lý Intel Core i3 12100 đảm bảo bạn có đủ sức mạnh để chạy các ứng dụng học tập,văn phòng và các tựa game nhẹ.', 'Ram 8GB giúp chạy nhiều ứng dụng cùng lúc mà không gặp phải vấn đề về hiệu suất.', 'Ổ cứng SSD 256GB cho tốc độ xử lý bà lưu trữ dữ liệu nhanh.', 'Thiết kế nhỏ gọn, có thể đặt nhiều nơi mà không lo chiếm diện tích.']",
PC CPS Core Work P144F305 i5-14400F / RTX 3050 / WIN11 PRO,https://cellphones.com.vn/pc-cps-core-work-p144f305.html,pc,Hãng khác,"{'Dung lượng RAM': '16GB', 'RAM': '2 x PC Kingston Fury 8GB 3200MHz KF432C16BB/8', 'SSD': 'SSD Adata Legend 710 PCIe Gen3 X4 M.2 2280 (R 2400/W 1800) 256GB', 'CPU': 'Intel Core i5-14400F (SN)', 'VGA': 'MSI GeForce RTX 3050 Ventus 2X 6G OC', 'Mainboard': 'MSI Pro B760M-E DDR4', 'Nguồn': 'Xigmatek Litepower II Plus IP750 600W', 'Chipset (PC lắp ráp)': 'B760M', 'Hệ điều hành': 'Windows 11 Pro', 'Loại case (PC)': 'Case Máy Tính Xigmatek XS-09 M-ATX', 'Loại PC': 'PC Intel'}","[{'color': 'default', 'price': 14890000}]","['https://cdn2.cellphones.com.vn/x/media/catalog/product/t/e/text_ng_n_12__7_4_9.png', 'https://cdn2.cellphones.com.vn/x/media/catalog/product/t/e/text_ng_n_15__7_154_9.png', 'https://cdn2.cellphones.com.vn/x/media/catalog/product/t/e/text_ng_n_14__8_9_8.png', 'https://cdn2.cellphones.com.vn/x/media/catalog/product/t/e/text_ng_n_13__7_8_9.png']","['Trang bị CPU Intel Core i5-14400F, mang lại hiệu suất mạnh mẽ cho các tác vụ văn phòng và xử lý đa nhiệm.', 'Mainboard MSI PRO B760M-E hỗ trợ DDR4, cung cấp tính năng ổn định và đáng tin cậy cho hệ thống.', 'Card đồ họa RTX 3050 Ventus 2X 6G OC cho khả năng xử lý đồ họa ấn tượng, phù hợp cho nhu cầu làm việc và giải trí.', 'RAM 16GB giúp xử lý đa nhiệm hiệu quả, đáp ứng nhu cầu sử dụng hàng ngày.', 'Ổ cứng SSD 256GB với tốc độ đọc 2400MB/s và ghi 1800MB/s, giúp khởi động nhanh chóng và tải ứng dụng hiệu quả.']",
PC CPS Creator AI H147 i7-14700K / RTX 5080,https://cellphones.com.vn/pc-cps-creator-ai-h147.html,pc,Hãng khác,"{'Dung lượng RAM': '32GB', 'RAM': 'PC Adata XPG Lancer RGB DDR5 6000MHz 32GB (2x16)', 'SSD': 'SSD Adata Legend 860 PCIe Gen4 X4 M.2 2280 (R 6000/W 5000) 1TB', 'CPU': 'Intel Core i7-14700K (SN)', 'VGA': 'ASUS TUF Gaming GeForce RTX 5080 OC 16GB TUF-RTX5080-O16G-Gaming', 'Mainboard': 'ASUS TUF Gaming B760M-Plus WiFi D5 (SN)', 'Nguồn': 'Corsair RM850E Đen', 'Chipset (PC lắp ráp)': 'B760M', 'Tản nhiệt': ['Tản Nhiệt Nước Corsair iCUE Link Titan 360 RX RGB Trắng ', 'Fan Case Corsair RS120 ARGB White (3 Pack)'], 'Loại case (PC)': 'Case Máy Tính Corsair 3500X Trắng', 'Loại PC': 'PC Intel'}","[{'color': 'default', 'price': 71990000}]","['https://cdn2.cellphones.com.vn/x/media/catalog/product/t/e/text_ng_n_3__7_83.png', 'https://cdn2.cellphones.com.vn/x/media/catalog/product/t/e/text_ng_n_4__7_138.png', 'https://cdn2.cellphones.com.vn/x/media/catalog/product/t/e/text_ng_n_6__4_127.png', 'https://cdn2.cellphones.com.vn/x/media/catalog/product/t/e/text_ng_n_5__9_145.png']","['Trang bị CPU Intel Core i7-14700K, mang lại hiệu suất xử lý mạnh mẽ cho các tác vụ nặng và sáng tạo nội dung.', 'Mainboard ASUS TUF Gaming B760M-PLUS với hỗ trợ WiFi, giúp kết nối ổn định và nhanh chóng.', 'VGA RTX 5080 OC 16GB cung cấp khả năng xử lý đồ họa tuyệt vời, rất thích hợp cho gaming và các ứng dụng đồ họa chuyên sâu.', 'RAM 32GB DDR5 với tốc độ 6000MHz không chỉ nâng cao hiệu suất mà còn tạo điểm nhấn thẩm mỹ với đèn RGB.', 'Ổ cứng SSD PCIe Gen4 1TB mang lại tốc độ truy xuất dữ liệu nhanh chóng, giúp khởi động hệ thống và tải ứng dụng tức thì.']",
PC CPS Core Work P146 i5-14600K / WIN11 PRO,https://cellphones.com.vn/pc-cps-core-work-p146.html,pc,Hãng khác,"{'Dung lượng RAM': '16GB', 'RAM': '2 x PC Transcend DDR4 3200MHz 8GB JM3200HLB-8G', 'SSD': 'SSD Adata Legend 710 PCIe Gen3 X4 M.2 2280 (R 2400/W 1800) 256GB', 'CPU': 'Intel Core i5-14600K (SN)', 'Mainboard': 'ASUS Prime B760M-A DDR4', 'Nguồn': 'Xigmatek Litepower II Plus IP750 600W', 'Chipset (PC lắp ráp)': 'B760M', 'Hệ điều hành': 'Windows 11 Pro', 'Loại case (PC)': 'Case Máy Tính Xigmatek XS-09 M-ATX', 'Loại PC': 'PC Intel'}","[{'color': 'default', 'price': 12490000}]","['https://cdn2.cellphones.com.vn/x/media/catalog/product/t/e/text_ng_n_12__7_4_8.png', 'https://cdn2.cellphones.com.vn/x/media/catalog/product/t/e/text_ng_n_15__7_154_8.png', 'https://cdn2.cellphones.com.vn/x/media/catalog/product/t/e/text_ng_n_14__8_9_7.png', 'https://cdn2.cellphones.com.vn/x/media/catalog/product/t/e/text_ng_n_13__7_8_8.png']","['PC trang bị CPU Intel Core i5-14600K, mang lại hiệu suất vượt trội cho các tác vụ văn phòng và xử lý đa nhiệm.', 'Mainboard ASUS PRIME B760M-A hỗ trợ DDR4, cung cấp tính năng ổn định và đáng tin cậy cho hệ thống.', 'RAM 16GB DDR4 3200MHz giúp xử lý đa nhiệm một cách mượt mà, đáp ứng nhu cầu sử dụng hằng ngày.', 'Ổ cứng SSD 256GB với tốc độ đọc 2400MB/s và ghi 1800MB/s, giúp khởi động nhanh chóng và tải ứng dụng hiệu quả.']",
PC CPS Core Work S121 i3-12100 / WIN11 PRO,https://cellphones.com.vn/pc-cps-core-work-s121.html,pc,Hãng khác,"{'Dung lượng RAM': '8GB', 'RAM': 'PC Transcend DDR4 3200MHz 8GB JM3200HLB-8G', 'SSD': 'SSD Adata Legend 710 PCIe Gen3 X4 M.2 2280 (R 2400/W 1800) 256GB', 'CPU': 'Intel Core i3 12100 (SN)', 'Mainboard': 'MSI Pro H610M-S DDR4', 'Nguồn': 'Jetek 350 Elite V2 350W', 'Chipset (PC lắp ráp)': 'H610M', 'Hệ điều hành': 'Windows 11 Pro', 'Loại case (PC)': 'Case Máy Tính Xigmatek XS-09 M-ATX', 'Loại PC': 'PC Intel'}","[{'color': 'default', 'price': 7190000}]","['https://cdn2.cellphones.com.vn/x/media/catalog/product/t/e/text_ng_n_12__7_4_2.png', 'https://cdn2.cellphones.com.vn/x/media/catalog/product/t/e/text_ng_n_15__7_154_2.png', 'https://cdn2.cellphones.com.vn/x/media/catalog/product/t/e/text_ng_n_14__8_9_1.png', 'https://cdn2.cellphones.com.vn/x/media/catalog/product/t/e/text_ng_n_13__7_8_2.png']","['Trang bị bộ vi xử lý Intel Core i3-12100, mang lại hiệu suất ổn định cho các tác vụ văn phòng và sử dụng hằng ngày.', 'Mainboard MSI PRO H610M-S hỗ trợ DDR4, cung cấp tính năng đáng tin cậy cho hệ thống.', 'RAM 8GB DDR4 3200MHz Transcend giúp xử lý đa nhiệm mượt mà và đáp ứng nhu cầu cơ bản.', 'Ổ cứng SSD 256GB với tốc độ đọc 2400MB/s và ghi 1800MB/s, giúp khởi động hệ thống và tải ứng dụng nhanh chóng.', 'Nguồn máy tính JETEK 350 Elite V2 350W đảm bảo cung cấp điện ổn định cho toàn bộ hệ thống.']",
PC CPS Creator AI A770 AMD Ryzen 7 7700X / RTX 5070,https://cellphones.com.vn/pc-cps-creator-ai-a770.html,pc,Hãng khác,"{'Dung lượng RAM': '32GB', 'RAM': 'PC Adata XPG Lancer RGB DDR5 6000MHz 32GB (2x16)', 'SSD': 'SSD Adata Legend 860 PCIe Gen4 X4 M.2 2280 (R 6000/W 5000) 1TB', 'CPU': 'AMD Ryzen 7 7700X (WOF)', 'VGA': 'ASUS TUF Gaming GeForce RTX 5070 OC 12GB TUF-RTX5070-O12G-Gaming', 'Mainboard': 'ASUS TUF Gaming B650M-E WiFi D5', 'Nguồn': 'Corsair CX750 (80 Plus Bronze)', 'Chipset (PC lắp ráp)': 'B650M', 'Tản nhiệt': ['Tản Nhiệt Nước Xigmatek LK 360 Digital Đen', 'Bộ 3 Fan Xigmatek Starlink A-RGB Đen (SN)'], 'Loại case (PC)': 'Case Máy Tính Xigmatek Meta (No Fan) E-ATX Đen', 'Loại PC': 'PC AMD'}","[{'color': 'default', 'price': 47990000}]","['https://cdn2.cellphones.com.vn/x/media/catalog/product/1/-/1-96_1_7.png', 'https://cdn2.cellphones.com.vn/x/media/catalog/product/6/-/6-96_1_6.png', 'https://cdn2.cellphones.com.vn/x/media/catalog/product/5/-/5-96_1_4.png', 'https://cdn2.cellphones.com.vn/x/media/catalog/product/3/-/3-96_1_6.png']","['Trang bị CPU AMD Ryzen 7 7700X, mang lại hiệu suất xử lý mạnh mẽ, lý tưởng cho các tác vụ nặng và sáng tạo nội dung.', 'Mainboard ASUS TUF Gaming B650M-E với hỗ trợ WiFi, giúp kết nối ổn định và nhanh chóng cho các tác vụ đòi hỏi băng thông cao.', 'VGA RTX 5070 OC 12GB cung cấp khả năng xử lý đồ họa xuất sắc, rất thích hợp cho gaming và các ứng dụng đồ họa chuyên sâu.', 'RAM 32GB DDR5 với tốc độ 6000MHz giúp nâng cao hiệu suất và tạo điểm nhấn thẩm mỹ với đèn RGB.', 'Ổ cứng SSD PCIe Gen4 1TB mang lại tốc độ truy xuất dữ liệu nhanh chóng, giúp khởi động hệ thống và tải ứng dụng tức thì.']",
